{
  "scenarioId": "dilution-effect",
  "name": "????",
  "description": "????? CuSO? ???????????????????",
  "version": "1.0",
  "initialParams": {
    "soluteIndex": 7,
    "soluteAmount": 0.9,
    "volume": 0.5,
    "valuesVisible": false
  },
  "paramRanges": {
    "soluteAmount": { "min": 0, "max": 1.0, "step": 0.050, "unit": "mol" },
    "volume": { "min": 0.2, "max": 1.0, "step": 0.050, "unit": "L" }
  },
  "concentrationMax": 5.0,
  "solutes": [
    { "name": "???", "formula": "Drink mix", "saturatedConcentration": 5.95, "solutionColorMin": "#FFE1E1", "solutionColorMax": "#FF0000", "particleColor": "#FF0000" },
    { "name": "????II?", "formula": "Co(NO?)?", "saturatedConcentration": 5.65, "solutionColorMin": "#FFE1E1", "solutionColorMax": "#FF0000", "particleColor": "#FF0000" },
    { "name": "???", "formula": "CoCl?", "saturatedConcentration": 4.35, "solutionColorMin": "#FFF2F2", "solutionColorMax": "#FF6A6A", "particleColor": "#FF6A6A" },
    { "name": "????", "formula": "K?Cr?O?", "saturatedConcentration": 0.50, "solutionColorMin": "#FFE8D2", "solutionColorMax": "#FF7F00", "particleColor": "#FF7F00" },
    { "name": "????III?", "formula": "AuCl?", "saturatedConcentration": 2.25, "solutionColorMin": "#FFFFC7", "solutionColorMax": "#FFD700", "particleColor": "#FFD700" },
    { "name": "???", "formula": "K?CrO?", "saturatedConcentration": 3.35, "solutionColorMin": "#FFFFC7", "solutionColorMax": "#FFFF00", "particleColor": "#FFFF00" },
    { "name": "????II?", "formula": "NiCl?", "saturatedConcentration": 5.2, "solutionColorMin": "#EAF4EA", "solutionColorMax": "#008000", "particleColor": "#008000" },
    { "name": "???", "formula": "CuSO?", "saturatedConcentration": 1.40, "solutionColorMin": "#DEEEFF", "solutionColorMax": "#1E90FF", "particleColor": "#1E90FF" },
    { "name": "????", "formula": "KMnO?", "saturatedConcentration": 0.50, "solutionColorMin": "#FF00FF", "solutionColorMax": "#8B008B", "particleColor": "#000000" }
  ],
  "performance": { "particlesPerMole": 200, "particleSize": 5 },
  "successCriteria": [
    { "id": "sc-1", "type": "precipitateVisible", "description": "???????????????????", "params": {} }
  ],
  "hints": [
    { "trigger": "precipitateAmount > 0", "message": "???????????????????????" }
  ]
}
