{
  "scenarioId": "quantitative-practice",
  "name": "定量练习",
  "description": "调整溶质量与体积，使溶液浓度精确达到 1.00 M（数值视图已开启）。",
  "version": "1.0",
  "initialParams": {
    "soluteIndex": 0,
    "soluteAmount": 0.5,
    "volume": 0.5,
    "valuesVisible": true
  },
  "paramRanges": {
    "soluteAmount": { "min": 0, "max": 1.0, "step": 0.050, "unit": "mol" },
    "volume": { "min": 0.2, "max": 1.0, "step": 0.050, "unit": "L" }
  },
  "concentrationMax": 5.0,
  "solutes": [
    { "name": "饮料粉", "formula": "Drink mix", "saturatedConcentration": 5.95, "solutionColorMin": "#FFE1E1", "solutionColorMax": "#FF0000", "particleColor": "#FF0000" },
    { "name": "硝酸钴（II）", "formula": "Co(NO₃)₂", "saturatedConcentration": 5.65, "solutionColorMin": "#FFE1E1", "solutionColorMax": "#FF0000", "particleColor": "#FF0000" },
    { "name": "氯化钴", "formula": "CoCl₂", "saturatedConcentration": 4.35, "solutionColorMin": "#FFF2F2", "solutionColorMax": "#FF6A6A", "particleColor": "#FF6A6A" },
    { "name": "重铬酸钾", "formula": "K₂Cr₂O₇", "saturatedConcentration": 0.50, "solutionColorMin": "#FFE8D2", "solutionColorMax": "#FF7F00", "particleColor": "#FF7F00" },
    { "name": "氯化金（III）", "formula": "AuCl₃", "saturatedConcentration": 2.25, "solutionColorMin": "#FFFFC7", "solutionColorMax": "#FFD700", "particleColor": "#FFD700" },
    { "name": "铬酸钾", "formula": "K₂CrO₄", "saturatedConcentration": 3.35, "solutionColorMin": "#FFFFC7", "solutionColorMax": "#FFFF00", "particleColor": "#FFFF00" },
    { "name": "氯化镍（II）", "formula": "NiCl₂", "saturatedConcentration": 5.2, "solutionColorMin": "#EAF4EA", "solutionColorMax": "#008000", "particleColor": "#008000" },
    { "name": "硫酸铜", "formula": "CuSO₄", "saturatedConcentration": 1.40, "solutionColorMin": "#DEEEFF", "solutionColorMax": "#1E90FF", "particleColor": "#1E90FF" },
    { "name": "高锰酸钾", "formula": "KMnO₄", "saturatedConcentration": 0.50, "solutionColorMin": "#FF00FF", "solutionColorMax": "#8B008B", "particleColor": "#000000" }
  ],
  "performance": { "particlesPerMole": 200, "particleSize": 5 },
  "successCriteria": [
    { "id": "sc-1", "type": "concentrationReached", "description": "调整参数使浓度 = 1.00 M", "params": { "targetConcentration": 1.00, "tolerance": 0.01 } }
  ],
  "hints": [
    { "trigger": "concentration < 0.9", "message": "浓度 = 溶质量 / 体积，试着同时调整两个滑块。" }
  ]
}
