{
  "scenarioId": "default",
  "name": "Molarity 自由探索",
  "description": "自由调节溶质量与体积，观察摩尔浓度的变化与饱和现象。",
  "version": "1.0",
  "initialParams": {
    "soluteIndex": 0,
    "soluteAmount": 0.5,
    "volume": 0.5,
    "valuesVisible": false
  },
  "paramRanges": {
    "soluteAmount": { "min": 0, "max": 1.0, "step": 0.050, "unit": "mol" },
    "volume": { "min": 0.2, "max": 1.0, "step": 0.050, "unit": "L" }
  },
  "concentrationMax": 5.0,
  "solutes": [
    { "name": "饮料粉", "formula": "Drink mix", "saturatedConcentration": 5.95, "solutionColorMin": "#FFE1E1", "solutionColorMax": "#FF0000", "particleColor": "#FF0000" },
    { "name": "硝酸钴（II）", "formula": "Co(NO₃)₂", "saturatedConcentration": 5.65, "solutionColorMin": "#FFE1E1", "solutionColorMax": "#FF0000", "particleColor": "#FF0000" },
    { "name": "氯化钴", "formula": "CoCl₂", "saturatedConcentration": 4.35, "solutionColorMin": "#FFF2F2", "solutionColorMax": "#FF6A6A", "particleColor": "#FF6A6A" },
    { "name": "重铬酸钾", "formula": "K₂Cr₂O₇", "saturatedConcentration": 0.50, "solutionColorMin": "#FFE8D2", "solutionColorMax": "#FF7F00", "particleColor": "#FF7F00" },
    { "name": "氯化金（III）", "formula": "AuCl₃", "saturatedConcentration": 2.25, "solutionColorMin": "#FFFFC7", "solutionColorMax": "#FFD700", "particleColor": "#FFD700" },
    { "name": "铬酸钾", "formula": "K₂CrO₄", "saturatedConcentration": 3.35, "solutionColorMin": "#FFFFC7", "solutionColorMax": "#FFFF00", "particleColor": "#FFFF00" },
    { "name": "氯化镍（II）", "formula": "NiCl₂", "saturatedConcentration": 5.2, "solutionColorMin": "#EAF4EA", "solutionColorMax": "#008000", "particleColor": "#008000" },
    { "name": "硫酸铜", "formula": "CuSO₄", "saturatedConcentration": 1.40, "solutionColorMin": "#DEEEFF", "solutionColorMax": "#1E90FF", "particleColor": "#1E90FF" },
    { "name": "高锰酸钾", "formula": "KMnO₄", "saturatedConcentration": 0.50, "solutionColorMin": "#FF00FF", "solutionColorMax": "#8B008B", "particleColor": "#000000" }
  ],
  "performance": { "particlesPerMole": 200, "particleSize": 5 },
  "successCriteria": [],
  "hints": [
    { "trigger": "precipitateAmount == 0", "message": "试试增加溶质量或减小体积，观察什么时候开始饱和。" },
    { "trigger": "isSaturated && soluteAmount < 0.8", "message": "溶液已经饱和了！继续加溶质会发生什么？浓度会继续升高吗？" }
  ],
  "inquiryTask": {
    "question": "浓度 C = 溶质量 n ÷ 体积 V。改变 n 和 V，观察浓度与沉淀如何变化。",
    "steps": [
      { "id": "step-1", "instruction": "固定体积为 0.5L，从 0.2mol 逐步增加到 1.0mol，记录浓度变化。", "hint": "每次调整后观察浓度条读数" },
      { "id": "step-2", "instruction": "固定溶质量为 0.5mol，把体积从 1.0L 减小到 0.2L，观察浓度。", "hint": "体积减小，浓度增大" },
      { "id": "step-3", "instruction": "选饱和浓度低的溶质（如 K₂Cr₂O₇），加到饱和后继续加溶质，观察沉淀。", "hint": "饱和后浓度不再升高，多出的溶质变成沉淀" }
    ],
    "snapshotColumns": [
      { "key": "soluteAmount", "label": "溶质(mol)", "source": "param" },
      { "key": "volume", "label": "体积(L)", "source": "param" },
      { "key": "concentration", "label": "浓度(M)", "source": "reading" },
      { "key": "precipitate", "label": "沉淀(mol)", "source": "reading" }
    ],
    "referenceConclusion": "浓度 = 溶质量 ÷ 体积（C = n/V）。当浓度达到饱和浓度后，继续增加溶质不会升高浓度，多余的溶质会以沉淀形式析出。",
    "predictions": [
      {
        "id": "p-1",
        "question": "固定体积 0.5L，把溶质从 0.2mol 加到 1.0mol，浓度会怎样变化？",
        "options": ["浓度升高", "浓度降低", "浓度不变"],
        "answer": 0,
        "explanation": "C = n / V：体积不变，溶质增加，浓度升高（成正比）。"
      },
      {
        "id": "p-2",
        "question": "固定溶质 0.5mol，把体积从 1.0L 减到 0.2L，浓度会怎样变化？",
        "options": ["浓度升高", "浓度降低", "浓度不变"],
        "answer": 0,
        "explanation": "C = n / V：溶质不变，体积减小，浓度升高（成反比）。"
      },
      {
        "id": "p-3",
        "question": "溶液已经饱和后，继续加溶质，浓度会怎样？",
        "options": ["浓度继续升高", "浓度不变（多余溶质变沉淀）", "浓度降低"],
        "answer": 1,
        "explanation": "饱和后浓度达到上限，多出的溶质以沉淀形式析出，浓度不再升高。"
      }
    ]
  }
}